{
  "version": 1,
  "command": "prove",
  "ok": true,
  "failed_phase": "",
  "phases": [
    {
      "id": "selfhost.copy",
      "status": "passed"
    }
  ],
  "selfhost": {
    "status": "passed",
    "structural_c_equal": true
  },
  "corpus": {
    "status": "passed",
    "cases": 0
  },
  "tooling": {
    "status": "passed"
  }
}
